{"schemaVersion":"1.0","user":{"firstName":"Rory"},"day":{"date":"2026-09-18","timezone":"Australia/Melbourne"},"bets":[{"sequence":1,"betTime":"2026-09-18T00:00:00.000Z","raceTime":"2026-09-18T00:08:00.000Z","raceId":"2026-09-18-R-BLA-1","raceName":"TQCSI THREE-YEAR-OLD BM64 HANDICAP","meeting":"BALAKLAVA","state":"SA","raceNumber":1,"runnerId":"BLA-R1-6","runnerNumber":6,"runnerName":"CHURCHILL ROSE","betType":"WIN","stake":20.0,"odds":7.5,"result":"LOSS","finishingPosition":0,"return":0.0,"profitLoss":-20.0,"runningPnl":-20.0,"replayUrl":"https://mediatabs.skyracing.com.au/Race_Replay/2026/09/20260916BAKR01_V.mp4"},{"sequence":2,"betTime":"2026-09-18T00:11:00.000Z","raceTime":"2026-09-18T00:19:00.000Z","raceId":"2026-09-18-R-BLA-2","raceName":"CLARE VALLEY TOYOTA MAIDEN PLATE","meeting":"BALAKLAVA","state":"SA","raceNumber":2,"runnerId":"BLA-R2-6","runnerNumber":6,"runnerName":"PRETTY MORSEL","betType":"WIN","stake":25.0,"odds":8.0,"result":"LOSS","finishingPosition":3,"return":0.0,"profitLoss":-25.0,"runningPnl":-45.0,"replayUrl":"https://mediatabs.skyracing.com.au/Race_Replay/2026/09/20260916BAKR02_V.mp4"},{"sequence":3,"betTime":"2026-09-18T00:22:00.000Z","raceTime":"2026-09-18T00:30:00.000Z","raceId":"2026-09-18-R-CAH-1","raceName":"SPORTSBET BLACKBOOK PLATE","meeting":"CAULFIELD HEATH","state":"VIC","raceNumber":1,"runnerId":"CAH-R1-7","runnerNumber":7,"runnerName":"SCAROLE","betType":"WIN","stake":30.0,"odds":4.2,"result":"WIN","finishingPosition":1,"return":126.0,"profitLoss":96.0,"runningPnl":51.0,"replayUrl":"https://mediatabs.skyracing.com.au/Race_Replay/2026/09/20260916HEAR01_V.mp4"},{"sequence":4,"betTime":"2026-09-18T00:33:00.000Z","raceTime":"2026-09-18T00:41:00.000Z","raceId":"2026-09-18-R-DOO-1","raceName":"BECOME A BRC MEMBER F&M MAIDEN PLATE","meeting":"DOOMBEN","state":"QLD","raceNumber":1,"runnerId":"DOO-R1-5","runnerNumber":5,"runnerName":"ZEPHYR SONG","betType":"WIN","stake":35.0,"odds":5.0,"result":"LOSS","finishingPosition":2,"return":0.0,"profitLoss":-35.0,"runningPnl":16.0,"replayUrl":"https://mediatabs.skyracing.com.au/Race_Replay/2026/09/20260916DOOR01_V.mp4"},{"sequence":5,"betTime":"2026-09-18T00:44:00.000Z","raceTime":"2026-09-18T00:52:00.000Z","raceId":"2026-09-18-R-BLA-3","raceName":"AGFERT MAIDEN PLATE","meeting":"BALAKLAVA","state":"SA","raceNumber":3,"runnerId":"BLA-R3-7","runnerNumber":7,"runnerName":"GLACIAL FIRE","betType":"PLACE","stake":40.0,"odds":1.95,"result":"WIN","finishingPosition":2,"return":78.0,"profitLoss":38.0,"runningPnl":54.0,"replayUrl":"https://mediatabs.skyracing.com.au/Race_Replay/2026/09/20260916BAKR03_V.mp4"}],"summary":{"totalBets":5,"totalStaked":150.0,"totalReturned":204.0,"wins":2,"losses":3,"finalPnl":54.0,"meetings":3,"biggestStake":40.0,"biggestWinSequence":3,"biggestLossSequence":4,"highestOddsWinnerSequence":3}}