{"schemaVersion":"1.0","user":{"firstName":"Rory"},"day":{"date":"2026-09-03","timezone":"Australia/Melbourne"},"bets":[{"sequence":1,"betTime":"2026-09-02T23:35:00.000Z","raceTime":"2026-09-02T23:45:00.000Z","raceId":"2026-09-03-R-TOH-1","raceName":"DEAN WILES RACING MAIDEN HURDLE","meeting":"TE AROHA","state":"NZL","raceNumber":1,"runnerId":"TOH-R1-9","runnerNumber":9,"runnerName":"ROSINA","betType":"WIN","stake":30,"odds":3.1,"result":"LOSS","finishingPosition":4,"return":0,"profitLoss":-30,"runningPnl":-30,"replayUrl":"https://mediatabs.skyracing.com.au/Race_Replay/2026/08/20260831BARR01_V.mp4"},{"sequence":2,"betTime":"2026-09-03T00:11:00.000Z","raceTime":"2026-09-03T00:21:00.000Z","raceId":"2026-09-03-R-TOH-2","raceName":"VET ASSOCIATE PAKURANGA HUNT OPEN HURDLE","meeting":"TE AROHA","state":"NZL","raceNumber":2,"runnerId":"TOH-R2-5","runnerNumber":5,"runnerName":"JAKE","betType":"WIN","stake":25,"odds":11,"result":"LOSS","finishingPosition":2,"return":0,"profitLoss":-25,"runningPnl":-55,"replayUrl":"https://mediatabs.skyracing.com.au/Race_Replay/2026/08/20260831BARR01_V.mp4"},{"sequence":3,"betTime":"2026-09-03T01:18:00.000Z","raceTime":"2026-09-03T01:28:00.000Z","raceId":"2026-09-03-R-TOH-4","raceName":"GREAT NZ JUMPS 18 & 20 SEPT STEEPLECHASE","meeting":"TE AROHA","state":"NZL","raceNumber":4,"runnerId":"TOH-R4-7","runnerNumber":7,"runnerName":"ROCEM","betType":"WIN","stake":20,"odds":5,"result":"WIN","finishingPosition":1,"return":100,"profitLoss":80,"runningPnl":25,"replayUrl":"https://mediatabs.skyracing.com.au/Race_Replay/2026/09/20260903TOHR04_V.mp4"},{"sequence":4,"betTime":"2026-09-03T02:01:00.000Z","raceTime":"2026-09-03T02:11:00.000Z","raceId":"2026-09-03-R-TOH-5","raceName":"COLIN WEST PANELBEATERS MAIDEN","meeting":"TE AROHA","state":"NZL","raceNumber":5,"runnerId":"TOH-R5-9","runnerNumber":9,"runnerName":"KALGARRY ALLY","betType":"WIN","stake":40,"odds":3,"result":"LOSS","finishingPosition":2,"return":0,"profitLoss":-40,"runningPnl":-15,"replayUrl":"https://mediatabs.skyracing.com.au/Race_Replay/2026/08/20260831BARR01_V.mp4"},{"sequence":5,"betTime":"2026-09-03T02:33:00.000Z","raceTime":"2026-09-03T02:43:00.000Z","raceId":"2026-09-03-R-TOH-6","raceName":"THE VALLEY TOYOTA PAKURANGA HUNT CUP","meeting":"TE AROHA","state":"NZL","raceNumber":6,"runnerId":"TOH-R6-9","runnerNumber":9,"runnerName":"ZEE HEIGHTS","betType":"PLACE","stake":25,"odds":3,"result":"WIN","finishingPosition":2,"return":75,"profitLoss":50,"runningPnl":35,"replayUrl":"https://mediatabs.skyracing.com.au/Race_Replay/2026/08/20260831BARR01_V.mp4"},{"sequence":6,"betTime":"2026-09-03T03:12:00.000Z","raceTime":"2026-09-03T03:22:00.000Z","raceId":"2026-09-03-R-TOH-7","raceName":"MANCO","meeting":"TE AROHA","state":"NZL","raceNumber":7,"runnerId":"TOH-R7-12","runnerNumber":12,"runnerName":"GIN AND BARE IT","betType":"WIN","stake":40,"odds":3.9,"result":"LOSS","finishingPosition":4,"return":0,"profitLoss":-40,"runningPnl":-5,"replayUrl":"https://mediatabs.skyracing.com.au/Race_Replay/2026/08/20260831BARR01_V.mp4"},{"sequence":7,"betTime":"2026-09-03T03:15:00.000Z","raceTime":"2026-09-03T03:25:00.000Z","raceId":"2026-09-03-R-COF-2","raceName":"CHOOSE PETTICOAT THE KOSCIUSZKO MAIDEN","meeting":"COFFS HARBOUR","state":"NSW","raceNumber":2,"runnerId":"COF-R2-2","runnerNumber":2,"runnerName":"INSAIN CHAOS","betType":"WIN","stake":45,"odds":3.5,"result":"LOSS","finishingPosition":2,"return":0,"profitLoss":-45,"runningPnl":-50,"replayUrl":"https://mediatabs.skyracing.com.au/Race_Replay/2026/08/20260831BARR01_V.mp4"},{"sequence":8,"betTime":"2026-09-03T03:20:00.000Z","raceTime":"2026-09-03T03:30:00.000Z","raceId":"2026-09-03-R-WBO-1","raceName":"RAFFERTYS TAVERN MAIDEN PLATE","meeting":"WARRNAMBOOL","state":"VIC","raceNumber":1,"runnerId":"WBO-R1-4","runnerNumber":4,"runnerName":"LE PLUS RAPIDE","betType":"WIN","stake":35,"odds":3,"result":"WIN","finishingPosition":1,"return":105,"profitLoss":70,"runningPnl":20,"replayUrl":"https://mediatabs.skyracing.com.au/Race_Replay/2026/09/20260903WARR01_V.mp4"},{"sequence":9,"betTime":"2026-09-03T03:35:00.000Z","raceTime":"2026-09-03T03:45:00.000Z","raceId":"2026-09-03-R-MAC-1","raceName":"LADBROKES SWITCH QTIS 3YO MAIDEN PLATE","meeting":"MACKAY","state":"QLD","raceNumber":1,"runnerId":"MAC-R1-4","runnerNumber":4,"runnerName":"SNEAKY PEAKY","betType":"PLACE","stake":40,"odds":2.2,"result":"LOSS","finishingPosition":4,"return":0,"profitLoss":-40,"runningPnl":-20,"replayUrl":"https://mediatabs.skyracing.com.au/Race_Replay/2026/08/20260831BARR01_V.mp4"},{"sequence":10,"betTime":"2026-09-03T03:45:00.000Z","raceTime":"2026-09-03T03:55:00.000Z","raceId":"2026-09-03-R-TOH-8","raceName":"GLENN OLD BLOODSTOCK","meeting":"TE AROHA","state":"NZL","raceNumber":8,"runnerId":"TOH-R8-7","runnerNumber":7,"runnerName":"SHE'LL BE RIGHT","betType":"PLACE","stake":25,"odds":3,"result":"WIN","finishingPosition":3,"return":75,"profitLoss":50,"runningPnl":30,"replayUrl":"https://mediatabs.skyracing.com.au/Race_Replay/2026/08/20260831BARR01_V.mp4"},{"sequence":11,"betTime":"2026-09-03T03:50:00.000Z","raceTime":"2026-09-03T04:00:00.000Z","raceId":"2026-09-03-R-WBO-2","raceName":"WESTERN DISTRICT ELECTRICAL MAIDEN PLATE","meeting":"WARRNAMBOOL","state":"VIC","raceNumber":2,"runnerId":"WBO-R2-8","runnerNumber":8,"runnerName":"SILENT DEVOTION","betType":"WIN","stake":40,"odds":10,"result":"LOSS","finishingPosition":2,"return":0,"profitLoss":-40,"runningPnl":-10,"replayUrl":"https://mediatabs.skyracing.com.au/Race_Replay/2026/08/20260831BARR01_V.mp4"},{"sequence":12,"betTime":"2026-09-03T03:55:00.000Z","raceTime":"2026-09-03T04:05:00.000Z","raceId":"2026-09-03-R-COF-3","raceName":"HAPPY 100TH BDAY COFFS HARBOUR GOLF CLUB","meeting":"COFFS HARBOUR","state":"NSW","raceNumber":3,"runnerId":"COF-R3-6","runnerNumber":6,"runnerName":"WHO LOVES A HARLEY","betType":"WIN","stake":30,"odds":151,"result":"LOSS","finishingPosition":4,"return":0,"profitLoss":-30,"runningPnl":-40,"replayUrl":"https://mediatabs.skyracing.com.au/Race_Replay/2026/09/20260903COHR03_V.mp4"},{"sequence":13,"betTime":"2026-09-03T04:10:00.000Z","raceTime":"2026-09-03T04:20:00.000Z","raceId":"2026-09-03-R-MAC-2","raceName":"LADBROKES ODDS SURGE QTIS 3YO MAIDEN","meeting":"MACKAY","state":"QLD","raceNumber":2,"runnerId":"MAC-R2-8","runnerNumber":8,"runnerName":"ELEGANT VENUS","betType":"PLACE","stake":20,"odds":2.5,"result":"WIN","finishingPosition":2,"return":50,"profitLoss":30,"runningPnl":-10,"replayUrl":"https://mediatabs.skyracing.com.au/Race_Replay/2026/09/20260903MACR02_V.mp4"},{"sequence":14,"betTime":"2026-09-03T04:18:00.000Z","raceTime":"2026-09-03T04:28:00.000Z","raceId":"2026-09-03-R-TOH-9","raceName":"GOLDEN HORSE FEEDS MAIDEN","meeting":"TE AROHA","state":"NZL","raceNumber":9,"runnerId":"TOH-R9-4","runnerNumber":4,"runnerName":"BACANA","betType":"WIN","stake":35,"odds":7.5,"result":"LOSS","finishingPosition":2,"return":0,"profitLoss":-35,"runningPnl":-45,"replayUrl":"https://mediatabs.skyracing.com.au/Race_Replay/2026/08/20260831BARR01_V.mp4"},{"sequence":15,"betTime":"2026-09-03T04:20:00.000Z","raceTime":"2026-09-03T04:30:00.000Z","raceId":"2026-09-03-R-WBO-3","raceName":"STREAMLINE FOODS MAIDEN PLATE","meeting":"WARRNAMBOOL","state":"VIC","raceNumber":3,"runnerId":"WBO-R3-8","runnerNumber":8,"runnerName":"STAR ROTATION","betType":"WIN","stake":40,"odds":4.5,"result":"WIN","finishingPosition":1,"return":180,"profitLoss":140,"runningPnl":95,"replayUrl":"https://mediatabs.skyracing.com.au/Race_Replay/2026/09/20260903WARR03_V.mp4"},{"sequence":16,"betTime":"2026-09-03T04:37:00.000Z","raceTime":"2026-09-03T04:47:00.000Z","raceId":"2026-09-03-R-NTM-1","raceName":"TIMES AT THE TRACK SUNDAY 13 SEPT MAIDEN","meeting":"NORTHAM","state":"WA","raceNumber":1,"runnerId":"NTM-R1-1","runnerNumber":1,"runnerName":"OBSCENTINO","betType":"WIN","stake":50,"odds":2.3,"result":"WIN","finishingPosition":1,"return":115,"profitLoss":65,"runningPnl":160,"replayUrl":"https://mediatabs.skyracing.com.au/Race_Replay/2026/09/20260903NOTR01_V.mp4"}],"summary":{"totalBets":16,"totalStaked":540,"totalReturned":700,"wins":7,"losses":9,"finalPnl":160,"meetings":5,"biggestStake":50,"biggestWinSequence":15,"biggestLossSequence":7,"highestOddsWinnerSequence":3}}